{
  "target_url": "http://localhost:3000",
  "scope": "Authorized web application penetration test of http://localhost:3000 only. This host is an isolated OWASP Juice Shop instance.",
  "model": null,
  "budget": {
    "tool_calls": null,
    "usd": null,
    "wall_time_s": 119
  },
  "workdir": "/Users/mason/pt-bench/results/example__noop/juice-shop/20260813-151456-r0/iter-00",
  "extra": {},
  "continuation": false
}